{
  "schemaVersion": 1,
  "product": "SolOS",
  "device": "jagar",
  "channel": "alpha",
  "updatedAt": "2026-10-26",
  "releases": [
    {
      "version": "1.0.18-alpha.10.23",
      "date": "2026-10-26",
      "sections": [
        {
          "type": "important",
          "title": "Important",
          "items": [
            "If you had split screen turned off or the Space Grotesk font chosen in Home, this update turns split screen back on and switches the font to Original once; you can change both again under Customization in Home."
          ]
        },
        {
          "type": "new",
          "title": "What's New",
          "items": [
            "Set your own photo as the wallpaper with Choose photo or video under Customization in Home.",
            "Open the tutorial's lessons straight from the new Tutorial app in your app list."
          ]
        },
        {
          "type": "improvements",
          "title": "Improvements",
          "items": [
            "Double-press the power button while your tablet is awake, including on the lock screen, to open Kindle, as you can from sleep; a single press now puts your tablet to sleep after a brief pause.",
            "See your taskbar apps lined up on the right.",
            "Close taskbar apps one after another with a quick flick up, without a pause in between.",
            "Keep the taskbar open, with Home behind it, when you close the app you were using.",
            "See Settings in dark colors when dark mode is on."
          ]
        },
        {
          "type": "fixes",
          "title": "Bug Fixes",
          "items": [
            "Fixed your tablet sometimes restarting while you write with the pen, for example in Noteshelf.",
            "Fixed included apps such as Chrome, Classroom and Kindle coming back after a restart or update once you had removed them.",
            "Fixed Software Update closing unexpectedly in split screen.",
            "Fixed the orange button waking your tablet from sleep without opening anything; it now leaves your tablet asleep.",
            "Fixed the clock and date not using the font you chose under Customization in Home.",
            "Fixed Home still showing its app list when you come back to it after opening an app."
          ]
        }
      ]
    },
    {
      "version": "1.0.18-alpha.10.22",
      "date": "2026-10-23",
      "sections": [
        {
          "type": "new",
          "title": "What's New",
          "items": [
            "Get a notice when an update is ready, with Remind me later and View update buttons.",
            "Choose an analog clock face for the lock screen under Customization in Home.",
            "Press and hold an app on the taskbar to open it in split screen, and swap the two apps with Change order.",
            "Choose the day your week starts on for the calendar in mission control.",
            "Switch apps with a sideways swipe along the bottom edge after turning on app-switch swipes under Experimental in Home; several fast swipes in a row keep switching.",
            "Hold an app in the sidebar to see its quick actions.",
            "Turn split screen on or off under Customization in Home.",
            "Uninstall Niagara, Markup, Exchange and Reader if you don't use them; a factory reset brings them back."
          ]
        },
        {
          "type": "improvements",
          "title": "Improvements",
          "items": [
            "Confirm before Software Update installs an update you started and restarts your tablet.",
            "See a short message while an update installs and restarts your tablet, and a note with the new version afterwards.",
            "Press the power button once to put your tablet to sleep right away.",
            "Double-press the power button while your tablet is asleep to open Kindle straight away, over the lock screen.",
            "Drag the Quick Settings sliders to change them; a tap no longer makes them jump.",
            "See the lock screen in two columns, clock and notifications side by side, when your tablet is on its side.",
            "See a thinner split-screen divider that follows dark mode.",
            "See app icons keep their solid shapes in dark mode, and the Logos app its own icon.",
            "Scroll the A to Z app list and return to Home more smoothly.",
            "See during setup when a Wi-Fi network needs a sign-in or has no internet."
          ]
        },
        {
          "type": "fixes",
          "title": "Bug Fixes",
          "items": [
            "Fixed a USB message that kept coming back, and file transfer stopping, while Daylight Link runs on a connected computer.",
            "Fixed Settings feeling slow; its pages open full screen again.",
            "Fixed Release Notes not opening from Software Update.",
            "Fixed Google Meet getting stuck on a loading screen during its first-time setup.",
            "Fixed “Unlock for all features” appearing on the lock screen after a restart.",
            "Fixed the lock screen picture flashing after you enter your PIN; the screen now fades into Home.",
            "Fixed the tutorial's app picker not showing all of your apps.",
            "Fixed a resting palm on the bottom edge opening the taskbar or switching apps while you write.",
            "Fixed apps shifting when you swipe up from the bottom edge; the pen still writes there and taps still reach the app.",
            "Fixed the Auto theme staying dark after sunrise when you wake your tablet.",
            "Fixed the orange button opening Note Overlay over the lock screen when pressed while your tablet is asleep or locked.",
            "Fixed split screen breaking when an app opens over the lock screen, such as Kindle from the power button; the pair comes back when you unlock."
          ]
        }
      ]
    },
    {
      "version": "1.0.18-alpha.10.17",
      "date": "2026-10-19",
      "sections": [
        {
          "type": "new",
          "title": "What's New",
          "items": [
            "Set a button shortcut to open the AI overlay."
          ]
        },
        {
          "type": "improvements",
          "title": "Improvements",
          "items": [
            "See a redesigned Settings app in the SolOS style."
          ]
        }
      ]
    },
    {
      "version": "1.0.18-alpha.10.16",
      "date": "2026-10-19",
      "sections": [
        {
          "type": "important",
          "title": "Important",
          "items": [
            "Daylight View is not included in this release."
          ]
        },
        {
          "type": "new",
          "title": "What's New",
          "items": [
            "Set a button shortcut to switch back to your previous app."
          ]
        },
        {
          "type": "improvements",
          "title": "Improvements",
          "items": [
            "Read the release notes in a window inside Software Update, with your installed version marked, instead of on a web page.",
            "Turn the light back on with a button shortcut and it returns to its last brightness.",
            "Tap the icons at either end of the Quick Settings sliders to adjust them.",
            "See the last stretch of the Amber slider marked with a notch, and hear a distinct sound at full Amber and at the lowest light.",
            "Follow the tutorial's taskbar lesson more easily, with only the lesson's app on the taskbar and your Home screen behind it."
          ]
        }
      ]
    },
    {
      "version": "1.0.18-alpha.10.15",
      "date": "2026-10-16",
      "sections": [
        {
          "type": "improvements",
          "title": "Improvements",
          "items": [
            "See refreshed welcome and setup-complete screens, with smoother animations, illustrated scenery and larger rounded buttons."
          ]
        }
      ]
    },
    {
      "version": "1.0.18-alpha.10.14",
      "date": "2026-10-16",
      "sections": [
        {
          "type": "important",
          "title": "Important",
          "items": [
            "After this update, your tablet returns to the Home space once; your previous spaces are backed up.",
            "Magic Ink is temporarily turned off in this release."
          ]
        },
        {
          "type": "new",
          "title": "What's New",
          "items": [
            "Open Quick Settings directly from the lock screen."
          ]
        },
        {
          "type": "improvements",
          "title": "Improvements",
          "items": [
            "Learn more from expanded tutorials covering the Home screen, taskbar and hardware buttons.",
            "See your app shortcuts as soon as the taskbar opens.",
            "Swipe in from the left edge to go back, leaving the right edge free for gestures inside apps.",
            "Get clearer guidance for the Amber slider and taskbar gestures.",
            "See refreshed Home screen visuals and smoother animations."
          ]
        }
      ]
    },
    {
      "version": "1.0.18-alpha.10.13",
      "date": "2026-10-16",
      "sections": [
        {
          "type": "important",
          "title": "Important",
          "items": [
            "This update removes the previous Note Overlay app and deletes the notes stored in it; its daily backups stay in Download/Note Overlay 3/Backups.",
            "Updates marked for automatic installation may now install and restart your tablet during the day, not only overnight."
          ]
        },
        {
          "type": "new",
          "title": "What's New",
          "items": [
            "Alpha tablets can now check for and install selected updates automatically."
          ]
        },
        {
          "type": "improvements",
          "title": "Improvements",
          "items": [
            "See a refreshed design in Software Update.",